<?xml version="1.0" encoding="UTF-8"?> 
<Modulo xmlns:xs="http://www.w3.org/2001/XMLSchema-instance" 
                xs:noNamespaceSchemaLocation="Tarefa_02_B.xsd"
                codigo="LM-DAM">

  <Duracion duracion="150" sesionsSemanais="3" sesionsAnuais="120"/>

  <Nome>Lenguaje de Marcas</Nome>


<Ciclo>Superior de DAM</Ciclo>
<Ciclo>Superior de DAM</Ciclo>
<Ciclo>Superior de DAM</Ciclo>

  <Contidos>
    <UnidadeDidactica Numero="1" Sesions="40">
      <Titulo>Introducción a XML</Titulo>
      <Descripcion>Conceptos básicos de XML y su estructura.</Descripcion>
    </UnidadeDidactica>

    <UnidadeDidactica Numero="2" Sesions="50">
      <Titulo>Validación y Transformación con XSD y XSLT</Titulo>
      <Descripcion>Uso de XSD para validar documentos XML y XSLT para transformación.</Descripcion>
    </UnidadeDidactica>

    <UnidadeDidactica Numero="3" Sesions="30">
      <Titulo>Desarrollo de documentos XML</Titulo>
      <Descripcion>Creación y manipulación de documentos XML.</Descripcion>
    </UnidadeDidactica>
  </Contidos>

</Modulo>